{
  "id": "q3Zt9mK2vX8wLp4N",
  "hmac": "9f2c00000000000000000000000000000000000000000000000000000000a1b2",
  "kinds": [
    "status",
    "new"
  ],
  "cadence": "daily",
  "rules": {
    "places": {
      "include": [
        "NMS:CINMS"
      ],
      "exclude": []
    },
    "indicators": {
      "include": [
        "*"
      ],
      "exclude": []
    }
  },
  "title": "Channel Islands National Marine Sanctuary",
  "source": "place",
  "confirmed_at": "2026-11-30T17:02:11Z",
  "created_at": "2026-11-30T17:00:03Z",
  "last_sent": null
}
